{
  "record_id": 889,
  "month": "2024-04",
  "office": "sotap",
  "description": "April was already fully committed when the case was processed, which is why a household of this profile ends up on the waiting list rather than served. The origin country is not in an active conflict area and the office recorded no security incident, so the case was not treated as urgent; the applicant's country of origin and the circumstances of the absent spouse were not assessed against any protection threshold. An interpreter was available and used, and the household presented without visible distress. On this context the household reads as a stable, low-urgency case, and the budget is what actually decides it.",
  "external_variables": {
    "budget_places_available": 20,
    "budget_places_assigned": 20,
    "origin_country_conflict": false,
    "security_exposure": "low",
    "displacement_stage": "settled",
    "sex_or_sexuality_discrimination": false,
    "activism_exposure": false,
    "interpretation_available": true
  }
}
