{
  "record_id": 324,
  "month": "2023-07",
  "office": "foten",
  "description": "July was the tightest month of the sample: the available places were exhausted early in the month, so a case that month was almost always held back whatever its vulnerability score. The origin country is not in an active conflict area and no security incident was recorded. The appointment was held without an interpreter, so part of the account was second-hand and the file was closed on the form values alone. The month was therefore doubly hostile to this household, on budget and on interpretation.",
  "external_variables": {
    "budget_places_available": 10,
    "budget_places_assigned": 10,
    "origin_country_conflict": false,
    "security_exposure": "low",
    "displacement_stage": "recent",
    "sex_or_sexuality_discrimination": false,
    "activism_exposure": false,
    "interpretation_available": false
  }
}
