{
  "record_id": 1592,
  "month": "2024-02",
  "office": "sotap",
  "description": "19 places were available in the month and 7 had already been assigned, so places were still open when the case was processed. The origin country is in an active conflict area, so the case was treated as urgent. Security exposure was recorded as high and the household was at the recent stage of displacement. A risk of sex or sexuality discrimination was recorded on the file. No activism exposure was recorded against the household. No interpreter was available, and the household was seen without one. The administrative flags are not part of this context: they belong to the scorecard, which is exactly why the model cannot weigh them. On this context the household reads as a stable, low-urgency case, and the budget is what actually decides it.",
  "external_variables": {
    "budget_places_available": 19,
    "budget_places_assigned": 7,
    "origin_country_conflict": true,
    "security_exposure": "high",
    "displacement_stage": "recent",
    "sex_or_sexuality_discrimination": true,
    "activism_exposure": false,
    "interpretation_available": false
  }
}
