{
  "record_id": 94,
  "month": "2024-05",
  "office": "pcr_cdmx",
  "description": "13 places were available in the month and 2 had already been assigned, so places were still open when the case was processed. The origin country is not in an active conflict area, so the case was not treated as urgent. Security exposure was recorded as medium and the household was at the settled stage of displacement. A risk of sex or sexuality discrimination was recorded on the file. No activism exposure was recorded against the household. No interpreter was available, and the household was seen without one. The administrative flags are not part of this context: they belong to the scorecard, which is exactly why the model cannot weigh them. On this context the household reads as a stable, low-urgency case, and the budget is what actually decides it.",
  "external_variables": {
    "budget_places_available": 13,
    "budget_places_assigned": 2,
    "origin_country_conflict": false,
    "security_exposure": "medium",
    "displacement_stage": "settled",
    "sex_or_sexuality_discrimination": true,
    "activism_exposure": false,
    "interpretation_available": false
  }
}
