{
  "record_id": 1780,
  "month": "2023-07",
  "office": "fupal",
  "description": "24 places were available in the month and 1 had already been assigned, so places were still open when the case was processed. The origin country is not in an active conflict area, so the case was not treated as urgent. Security exposure was recorded as medium and the household was at the long_term stage of displacement. No sex or sexuality discrimination risk was recorded on the file. No activism exposure was recorded against the household. An interpreter was available and used, and the household presented without visible distress. The administrative flags are not part of this context: they belong to the scorecard, which is exactly why the model cannot weigh them. On this context the household reads as a stable, low-urgency case, and the budget is what actually decides it.",
  "external_variables": {
    "budget_places_available": 24,
    "budget_places_assigned": 1,
    "origin_country_conflict": false,
    "security_exposure": "medium",
    "displacement_stage": "long_term",
    "sex_or_sexuality_discrimination": false,
    "activism_exposure": false,
    "interpretation_available": true
  }
}
