{
  "record_id": 827,
  "month": "2024-04",
  "office": "foten",
  "description": "19 places were available in the month and 9 had already been assigned, so places were still open when the case was processed. The origin country is in an active conflict area, so the case was treated as urgent. Security exposure was recorded as medium and the household was at the long_term stage of displacement. No sex or sexuality discrimination risk was recorded on the file. No activism exposure was recorded against the household. No interpreter was available, and the household was seen without one. The administrative flags are not part of this context: they belong to the scorecard, which is exactly why the model cannot weigh them. On this context the household reads as a stable, low-urgency case, and the budget is what actually decides it.",
  "external_variables": {
    "budget_places_available": 19,
    "budget_places_assigned": 9,
    "origin_country_conflict": true,
    "security_exposure": "medium",
    "displacement_stage": "long_term",
    "sex_or_sexuality_discrimination": false,
    "activism_exposure": false,
    "interpretation_available": false
  }
}
