{
  "record_id": 1872,
  "month": "2024-01",
  "office": "sotap",
  "description": "16 places were available in the month and 10 had already been assigned, so places were still open when the case was processed. The origin country is in an active conflict area, so the case was treated as urgent. Security exposure was recorded as medium and the household was at the settled stage of displacement. No sex or sexuality discrimination risk was recorded on the file. The household is known for activism, which the month treated as a risk. An interpreter was available and used, and the household presented without visible distress. The administrative flags are not part of this context: they belong to the scorecard, which is exactly why the model cannot weigh them. On this context the household reads as a stable, low-urgency case, and the budget is what actually decides it.",
  "external_variables": {
    "budget_places_available": 16,
    "budget_places_assigned": 10,
    "origin_country_conflict": true,
    "security_exposure": "medium",
    "displacement_stage": "settled",
    "sex_or_sexuality_discrimination": false,
    "activism_exposure": true,
    "interpretation_available": true
  }
}
